{
  "$schema": "https://json-schema.org/draft/2020-12/schema",
  "$id": "https://dabbler.ai/schemas/contract-floor-result.schema.json",
  "title": "ContractFloorResult",
  "description": "Set 068 S5 - the raw result of running a set's contract command (declared in contract-manifest.json) in the Set 068 S1 disposable run_test cage. Written as contract-floor-result.json beside spec.md by the producer (python -m ai_router.contract_gate run). Records the RAW exit code + captured output (deterministic-servant discipline - never summarized). The close-out gate confirms a valid result of this shape exists, that its sessionSetName matches the set and its command matches the manifest, and that the floor PASSED (ran AND exitCode == 0 AND not timedOut AND the worktree was torn down). This JSON Schema is the STRUCTURAL contract; the runtime gate uses ai_router.contract_gate.validate_contract_floor_result, which additionally requires the recorded 'passed' flag to AGREE with that derived criterion. See docs/contract-gate.md.",
  "type": "object",
  "additionalProperties": false,
  "required": [
    "schemaVersion",
    "sessionSetName",
    "contractGate",
    "command",
    "ran",
    "passed",
    "exitCode",
    "timedOut",
    "worktreeCreated",
    "worktreeRemoved"
  ],
  "properties": {
    "schemaVersion": {
      "description": "Envelope schema version. 1 = the v1 contract locked in Set 068 S5.",
      "type": "integer",
      "enum": [1]
    },
    "sessionSetName": {
      "description": "The slug of the session set this floor result covers. The close-out gate confirms it matches the set being closed.",
      "type": "string",
      "minLength": 1
    },
    "contractGate": {
      "description": "The policy level under which the floor was produced.",
      "type": "string",
      "enum": ["none", "advisory", "required"]
    },
    "ref": {
      "description": "The git ref the cage checked a disposable worktree out from (provenance).",
      "type": "string",
      "minLength": 1
    },
    "command": {
      "description": "The resolved contract argv that actually ran (must match the manifest command).",
      "type": "array",
      "minItems": 1,
      "items": { "type": "string", "minLength": 1 }
    },
    "ran": {
      "description": "True iff the cage was created AND the command executed (NOT whether tests passed).",
      "type": "boolean"
    },
    "passed": {
      "description": "The floor pass flag: ran AND exitCode == 0 AND not timedOut AND worktreeRemoved. Must agree with that derived criterion (the runtime validator rejects a mismatch).",
      "type": "boolean"
    },
    "exitCode": {
      "description": "The command's raw exit code; null if it was killed (timeout).",
      "type": ["integer", "null"]
    },
    "timedOut": {
      "description": "True iff the cage wall-clock cap fired and the process was killed.",
      "type": "boolean"
    },
    "wallSeconds": {
      "description": "Measured wall-clock of the command.",
      "type": "number"
    },
    "worktreeCreated": {
      "description": "Cage-lifecycle provenance: the disposable worktree was created.",
      "type": "boolean"
    },
    "worktreeRemoved": {
      "description": "Cage-lifecycle provenance: the disposable worktree was fully torn down (a surviving registration is a leak and fails the floor).",
      "type": "boolean"
    },
    "producedAt": {
      "description": "Optional ISO-8601 timestamp recording when the floor was produced.",
      "type": "string"
    },
    "output": {
      "description": "The raw combined stdout+stderr (capped/elided), or the raw cage error when the command did not run. Never paraphrased.",
      "type": "string"
    }
  }
}
