{
  "schemaVersion": 1,
  "sessionSetName": "068-cadence-study-and-contract-gate",
  "contractGate": "required",
  "ref": "HEAD",
  "command": ["python", "-m", "pytest", "-q", "tests/contract"],
  "ran": true,
  "passed": true,
  "exitCode": 0,
  "timedOut": false,
  "wallSeconds": 12.34,
  "worktreeCreated": true,
  "worktreeRemoved": true,
  "producedAt": "2026-06-15T00:00:00+00:00",
  "output": "[stdout]\n42 passed in 11.9s\n"
}
